{"$id":"https://moving-origin-research.invalid/schemas/m4-model-qualification-plan-v1","$schema":"https://json-schema.org/draft/2020-12/schema","additionalProperties":false,"properties":{"battery_bindings":{"type":"object"},"date":{"const":"2026-08-21"},"escalation":{"type":"array"},"gate_order":{"const":["Q1_FORMAT","Q2_INFORMATIVE_BAND","Q3_MIRROR_CALIBRATABILITY"]},"mode":{"const":"O-15-DIAGNOSTIC-ONLY"},"prohibitions":{"items":{"type":"string"},"type":"array","uniqueItems":true},"q1":{"type":"object"},"q2":{"type":"object"},"q3":{"type":"object"},"regime":{"const":"B"},"rung_order":{"const":["PRIMARY_QWEN3_4B_FP8","FALLBACK_QWEN3_8B_FP8"]},"schema_version":{"const":"m4-model-qualification-plan-v1"},"seed_order":{"const":[101,102,103,104,105]},"source_class":{"const":"PROPOSED"},"status":{"const":"BLOCKED_PENDING_BATTERY_SHA_AND_REBECCA_Q2_SIGNATURE"}},"required":["schema_version","date","regime","source_class","status","mode","seed_order","rung_order","battery_bindings","gate_order","q1","q2","q3","escalation","prohibitions"],"title":"M4 model qualification plan v1","type":"object","x-artifact-date":"2026-08-21","x-artifact-regime":"B","x-source-class":"PROPOSED"}
