{"battery_bindings":{"harder":{"manifest_path":null,"manifest_sha256":null,"status":"UNBOUND_REQUIRES_REBECCA_RELEASE"},"standard":{"manifest_path":null,"manifest_sha256":null,"status":"UNBOUND_REQUIRES_REBECCA_RELEASE"}},"date":"2026-08-21","escalation":[{"from":"PRIMARY_QWEN3_4B_FP8/Q1_FAIL","to":"FALLBACK_QWEN3_8B_FP8/Q1_STANDARD"},{"from":"PRIMARY_QWEN3_4B_FP8/Q2_CEILING_STANDARD","to":"PRIMARY_QWEN3_4B_FP8/Q2_HARDER"},{"from":"PRIMARY_QWEN3_4B_FP8/Q2_CEILING_HARDER","to":"FALLBACK_QWEN3_8B_FP8/Q1_STANDARD"},{"from":"PRIMARY_QWEN3_4B_FP8/Q2_FLOOR_OR_OTHER","to":"FALLBACK_QWEN3_8B_FP8/Q1_STANDARD"},{"from":"PRIMARY_QWEN3_4B_FP8/Q3_FAIL","to":"FALLBACK_QWEN3_8B_FP8/Q1_STANDARD"},{"from":"FALLBACK_QWEN3_8B_FP8/ANY_FAIL","to":"NO_QUALIFYING_RUNG"}],"gate_order":["Q1_FORMAT","Q2_INFORMATIVE_BAND","Q3_MIRROR_CALIBRATABILITY"],"mode":"O-15-DIAGNOSTIC-ONLY","prohibitions":["adaptive_change","rerun_failed_stage","backbone_update","qlora","protected_seed","scoring","out_of_ladder_model","llama_peer"],"q1":{"aggregation":"each seed independently","metric":"schema_valid_rate","predicate":"value == 1.0","source_class":"PROPOSED"},"q2":{"answered_selective_risk":[0.1,0.4],"confidence_interval":[0.6,0.8],"coverage":[0.3,0.8],"each_seed_accuracy":[0.55,0.9],"each_seed_mass_min":0.15,"endpoints":"inclusive","pooled_accuracy":[0.6,0.85],"pooled_mass_min":0.2,"source_class":"PROPOSED_PENDING_REBECCA_SIGNATURE","tau_q":0.7},"q3":{"ece_bins":15,"ece_max":0.1,"evaluation_seeds":[104,105],"fit_seeds":[101,102,103],"grid":{"a_start":0.5,"a_step":0.05,"a_stop":2,"b_start":-1,"b_step":0.05,"b_stop":1,"iteration_order":"a_outer_b_inner","tie_rule":"lower_a_then_lower_b"},"source_class":"LAW-L7_AND_PROPOSED_ALGORITHM"},"regime":"B","rung_order":["PRIMARY_QWEN3_4B_FP8","FALLBACK_QWEN3_8B_FP8"],"schema_version":"m4-model-qualification-plan-v1","seed_order":[101,102,103,104,105],"source_class":"PROPOSED","status":"BLOCKED_PENDING_BATTERY_SHA_AND_REBECCA_Q2_SIGNATURE"}
